{
  "plan_dir": "/Users/dm/dev/dev/xlocal/xl-skills/.worktrees/task-20260701-214243-wt-1/plugin-plans/ubm-goal-setting",
  "evaluator": {
    "name": "assign-plugin-plan-evaluator",
    "version": "0.1.0",
    "context": "fork"
  },
  "verdict": "PASS",
  "conditions": {
    "C1": {
      "id": "no_contradiction",
      "status": "PASS",
      "summary": "矛盾なし: deterministic gates passed",
      "evidence": [
        "check-build-handoff exit=0"
      ]
    },
    "C2": {
      "id": "no_missing",
      "status": "PASS",
      "summary": "漏れなし: deterministic gates passed",
      "evidence": [
        "detect-unassigned exit=0",
        "check-spec-frontmatter exit=0",
        "check-spec-gates exit=0",
        "check-surface-inventory exit=0",
        "check-requirements-coverage exit=0"
      ]
    },
    "C3": {
      "id": "consistent",
      "status": "PASS",
      "summary": "整合性あり: deterministic gates passed",
      "evidence": [
        "check-spec-frontmatter exit=0",
        "check-spec-gates exit=0",
        "check-spec-matrix-coverage-self-test exit=0",
        "check-spec-matrix-coverage-plan exit=0"
      ]
    },
    "C4": {
      "id": "dependency_integrity",
      "status": "PASS",
      "summary": "依存関係整合: deterministic gates passed",
      "evidence": [
        "verify-index-topsort exit=0",
        "detect-unassigned exit=0",
        "check-build-handoff exit=0"
      ]
    }
  },
  "gate_results": [
    {
      "id": "G1",
      "name": "verify-index-topsort",
      "command": [
        "/Users/dm/miniconda3/bin/python3",
        "/Users/dm/dev/dev/xlocal/xl-skills/.worktrees/task-20260701-214243-wt-1/plugins/plugin-dev-planner/skills/run-plugin-dev-plan/scripts/verify-index-topsort.py",
        "/Users/dm/dev/dev/xlocal/xl-skills/.worktrees/task-20260701-214243-wt-1/plugin-plans/ubm-goal-setting"
      ],
      "exit_code": 0,
      "conditions": [
        "C4"
      ],
      "stdout": "OK: index が §9 section 床を満たし P01..P13 を昇順全列挙し component 依存 DAG が非循環",
      "stderr": ""
    },
    {
      "id": "G2",
      "name": "detect-unassigned",
      "command": [
        "/Users/dm/miniconda3/bin/python3",
        "/Users/dm/dev/dev/xlocal/xl-skills/.worktrees/task-20260701-214243-wt-1/plugins/plugin-dev-planner/skills/run-plugin-dev-plan/scripts/detect-unassigned.py",
        "--inventory",
        "/Users/dm/dev/dev/xlocal/xl-skills/.worktrees/task-20260701-214243-wt-1/plugin-plans/ubm-goal-setting/component-inventory.json",
        "--specs-dir",
        "/Users/dm/dev/dev/xlocal/xl-skills/.worktrees/task-20260701-214243-wt-1/plugin-plans/ubm-goal-setting"
      ],
      "exit_code": 0,
      "conditions": [
        "C2",
        "C4"
      ],
      "stdout": "OK: 13 フェーズ完全・section 床充足・orphan 0 件・全 component が build_target を保持",
      "stderr": ""
    },
    {
      "id": "G3",
      "name": "check-spec-frontmatter",
      "command": [
        "/Users/dm/miniconda3/bin/python3",
        "/Users/dm/dev/dev/xlocal/xl-skills/.worktrees/task-20260701-214243-wt-1/plugins/plugin-dev-planner/skills/run-plugin-dev-plan/scripts/check-spec-frontmatter.py",
        "--specs-dir",
        "/Users/dm/dev/dev/xlocal/xl-skills/.worktrees/task-20260701-214243-wt-1/plugin-plans/ubm-goal-setting"
      ],
      "exit_code": 0,
      "conditions": [
        "C2",
        "C3"
      ],
      "stdout": "OK: 13 phase frontmatter + inventory component 契約を充足",
      "stderr": ""
    },
    {
      "id": "G4",
      "name": "check-spec-gates",
      "command": [
        "/Users/dm/miniconda3/bin/python3",
        "/Users/dm/dev/dev/xlocal/xl-skills/.worktrees/task-20260701-214243-wt-1/plugins/plugin-dev-planner/skills/run-plugin-dev-plan/scripts/check-spec-gates.py",
        "--specs-dir",
        "/Users/dm/dev/dev/xlocal/xl-skills/.worktrees/task-20260701-214243-wt-1/plugin-plans/ubm-goal-setting"
      ],
      "exit_code": 0,
      "conditions": [
        "C2",
        "C3"
      ],
      "stdout": "OK: inventory component gates/harness + index.plugin_meta 規律を機械強制で満たす",
      "stderr": ""
    },
    {
      "id": "G5",
      "name": "check-spec-matrix-coverage-self-test",
      "command": [
        "/Users/dm/miniconda3/bin/python3",
        "/Users/dm/dev/dev/xlocal/xl-skills/.worktrees/task-20260701-214243-wt-1/plugins/plugin-dev-planner/skills/run-plugin-dev-plan/scripts/check-spec-matrix-coverage.py",
        "--self-test"
      ],
      "exit_code": 0,
      "conditions": [
        "C3"
      ],
      "stdout": "OK: 46行 table と reflection.md が一致 (id 集合/分類/焼き先層 drift なし)",
      "stderr": ""
    },
    {
      "id": "G6",
      "name": "check-spec-matrix-coverage-plan",
      "command": [
        "/Users/dm/miniconda3/bin/python3",
        "/Users/dm/dev/dev/xlocal/xl-skills/.worktrees/task-20260701-214243-wt-1/plugins/plugin-dev-planner/skills/run-plugin-dev-plan/scripts/check-spec-matrix-coverage.py",
        "/Users/dm/dev/dev/xlocal/xl-skills/.worktrees/task-20260701-214243-wt-1/plugin-plans/ubm-goal-setting"
      ],
      "exit_code": 0,
      "conditions": [
        "C3"
      ],
      "stdout": "matrix 分類: OP=10 / conditional=19 / N-A=17 (計 46)\nOK: 適用される全マトリクス行の焼き先が反映済み",
      "stderr": ""
    },
    {
      "id": "G7",
      "name": "check-surface-inventory",
      "command": [
        "/Users/dm/miniconda3/bin/python3",
        "/Users/dm/dev/dev/xlocal/xl-skills/.worktrees/task-20260701-214243-wt-1/plugins/plugin-dev-planner/skills/run-plugin-dev-plan/scripts/check-surface-inventory.py",
        "/Users/dm/dev/dev/xlocal/xl-skills/.worktrees/task-20260701-214243-wt-1/plugin-plans/ubm-goal-setting/component-inventory.json"
      ],
      "exit_code": 0,
      "conditions": [
        "C2"
      ],
      "stdout": "OK: 5 component_kind 検討証跡 + plugin-level surface 採否が明示済み",
      "stderr": ""
    },
    {
      "id": "G8",
      "name": "check-build-handoff",
      "command": [
        "/Users/dm/miniconda3/bin/python3",
        "/Users/dm/dev/dev/xlocal/xl-skills/.worktrees/task-20260701-214243-wt-1/plugins/plugin-dev-planner/skills/run-plugin-dev-plan/scripts/check-build-handoff.py",
        "/Users/dm/dev/dev/xlocal/xl-skills/.worktrees/task-20260701-214243-wt-1/plugin-plans/ubm-goal-setting/handoff-run-plugin-dev-plan.json"
      ],
      "exit_code": 0,
      "conditions": [
        "C1",
        "C4"
      ],
      "stdout": "OK: build handoff が 18 routes と envelope 契約を満たす",
      "stderr": ""
    },
    {
      "id": "G9",
      "name": "check-requirements-coverage",
      "command": [
        "/Users/dm/miniconda3/bin/python3",
        "/Users/dm/dev/dev/xlocal/xl-skills/.worktrees/task-20260701-214243-wt-1/plugins/plugin-dev-planner/skills/run-plugin-dev-plan/scripts/check-requirements-coverage.py",
        "/Users/dm/dev/dev/xlocal/xl-skills/.worktrees/task-20260701-214243-wt-1/plugin-plans/ubm-goal-setting"
      ],
      "exit_code": 0,
      "conditions": [
        "C2"
      ],
      "stdout": "OK: goal-spec checklist の全要件 id が index の完了チェックリスト/受入確認へトレース済み",
      "stderr": ""
    }
  ],
  "findings": [
    {
      "severity": "info",
      "bucket": "C1-C4",
      "observation": "All deterministic gates exited 0 and plugin-level surfaces were explicit.",
      "evidence": [
        "/Users/dm/dev/dev/xlocal/xl-skills/.worktrees/task-20260701-214243-wt-1/plugin-plans/ubm-goal-setting"
      ]
    }
  ]
}
